{
  "$schema": "https://json-schema.org/draft/2020-12/schema",
  "$id": "https://thoughtseed.space/schemas/temperance/install-surface/fragment/v1",
  "title": "Temperance install-surface fragment v1",
  "type": "object",
  "additionalProperties": false,
  "required": ["schema", "schema_uri", "version", "records"],
  "properties": {
    "schema": { "const": "temperance.install-surface.fragment.v1" },
    "schema_uri": { "const": "https://thoughtseed.space/schemas/temperance/install-surface/fragment/v1" },
    "version": { "$ref": "#/$defs/version" },
    "records": {
      "type": "array",
      "maxItems": 4096,
      "items": { "$ref": "#/$defs/record" }
    }
  },
  "$defs": {
    "version": {
      "type": "object",
      "additionalProperties": false,
      "required": ["major", "minor"],
      "properties": {
        "major": { "const": 1 },
        "minor": { "const": 0 }
      }
    },
    "ownership": {
      "type": "object",
      "additionalProperties": false,
      "required": ["kind"],
      "properties": {
        "kind": { "enum": ["exclusive-path", "managed-block"] },
        "marker_id": { "type": "string", "minLength": 1, "maxLength": 192, "pattern": "^[A-Za-z0-9][A-Za-z0-9._-]*$" }
      }
    },
    "destination": {
      "type": "object",
      "additionalProperties": false,
      "required": ["root_token", "relative_path", "ownership"],
      "properties": {
        "root_token": { "type": "string", "minLength": 1, "maxLength": 64, "pattern": "^[A-Z][A-Z0-9_]*(?![\\s\\S])" },
        "relative_path": { "type": "string", "minLength": 1, "maxLength": 1024 },
        "ownership": { "$ref": "#/$defs/ownership" }
      }
    },
    "authority": {
      "type": "object",
      "additionalProperties": false,
      "required": ["requirement_ids", "isa"],
      "properties": {
        "requirement_ids": {
          "type": "array",
          "minItems": 1,
          "maxItems": 64,
          "uniqueItems": true,
          "items": { "type": "string", "pattern": "^[A-Z]+-[0-9]+$" }
        },
        "isa": { "type": "string", "pattern": "^ISC-[0-9]+$" }
      }
    },
    "eligibility": {
      "type": "object",
      "additionalProperties": false,
      "required": ["platforms", "profiles", "required"],
      "properties": {
        "platforms": { "type": "array", "minItems": 1, "uniqueItems": true, "items": { "enum": ["darwin", "linux", "win32"] } },
        "profiles": { "type": "array", "minItems": 1, "uniqueItems": true, "items": { "type": "string", "minLength": 1, "maxLength": 64 } },
        "required": { "type": "boolean" }
      }
    },
    "verification": {
      "type": "object",
      "additionalProperties": false,
      "required": ["method"],
      "properties": {
        "method": { "enum": ["sha256", "adapter", "semantic-probe", "symbolic-exclusion", "presence-only", "plist-sha256"] },
        "expected": { "$ref": "#/$defs/copy_expectation" },
        "adapter_id": { "type": "string", "minLength": 1, "maxLength": 192 },
        "generator_id": { "type": "string", "minLength": 1, "maxLength": 192 }
      }
    },
    "sha256": {
      "type": "string",
      "pattern": "^sha256:[a-f0-9]{64}$"
    },
    "copy_mode": {
      "enum": ["0644", "0755"]
    },
    "copy_expectation": {
      "oneOf": [
        {
          "type": "object",
          "additionalProperties": false,
          "required": ["kind", "sha256"],
          "properties": {
            "kind": { "const": "file" },
            "sha256": { "$ref": "#/$defs/sha256" },
            "mode": { "$ref": "#/$defs/copy_mode" }
          }
        },
        {
          "type": "object",
          "additionalProperties": false,
          "required": ["kind", "files"],
          "properties": {
            "kind": { "const": "tree" },
            "files": {
              "type": "object",
              "minProperties": 1,
              "maxProperties": 4096,
              "propertyNames": {
                "type": "string",
                "minLength": 1,
                "maxLength": 1024,
                "pattern": "^[A-Za-z0-9][A-Za-z0-9._/-]*$"
              },
              "additionalProperties": { "$ref": "#/$defs/sha256" }
            },
            "modes": {
              "type": "object",
              "minProperties": 1,
              "maxProperties": 4096,
              "propertyNames": {
                "type": "string",
                "minLength": 1,
                "maxLength": 1024,
                "pattern": "^[A-Za-z0-9][A-Za-z0-9._/-]*$"
              },
              "additionalProperties": { "$ref": "#/$defs/copy_mode" }
            }
          }
        }
      ]
    },
    "rollback": {
      "type": "object",
      "additionalProperties": false,
      "required": ["policy"],
      "properties": {
        "policy": { "enum": ["restore-backup", "remove-installed", "regenerate", "none-private", "unload-and-restore"] }
      }
    },
    "identity_migration": {
      "type": "object",
      "additionalProperties": false,
      "required": ["from_id", "to_id"],
      "properties": {
        "from_id": { "type": "string", "minLength": 1, "maxLength": 192 },
        "to_id": { "type": "string", "minLength": 1, "maxLength": 192 }
      }
    },
    "record": {
      "type": "object",
      "additionalProperties": false,
      "required": ["id", "owner", "class", "destination", "authority", "eligibility", "verification", "rollback"],
      "properties": {
        "id": { "type": "string", "minLength": 3, "maxLength": 192, "pattern": "^[a-z0-9][a-z0-9._-]*$" },
        "owner": { "type": "string", "minLength": 1, "maxLength": 128 },
        "class": { "enum": ["COPY", "TRANSFORM", "REGENERATE", "NEVER-SHIP", "LAUNCHAGENT"] },
        "source": { "type": "string", "minLength": 1, "maxLength": 1024 },
        "label": { "type": "string", "minLength": 1, "maxLength": 256, "pattern": "^[a-z][a-z0-9.-]*$" },
        "plist_template": { "type": "string", "minLength": 1, "maxLength": 16384 },
        "bindings": { "type": "object", "additionalProperties": { "type": "string" } },
        "destination": { "$ref": "#/$defs/destination" },
        "authority": { "$ref": "#/$defs/authority" },
        "eligibility": { "$ref": "#/$defs/eligibility" },
        "verification": { "$ref": "#/$defs/verification" },
        "rollback": { "$ref": "#/$defs/rollback" },
        "depends_on": { "type": "array", "maxItems": 128, "uniqueItems": true, "items": { "type": "string", "minLength": 3, "maxLength": 192 } },
        "identity_migration": { "$ref": "#/$defs/identity_migration" },
        "requires": {"type": "array", "maxItems": 32, "uniqueItems": true, "items": {"$ref": "#/$defs/runtime_dependency"}}
      }
    },
    "runtime_dependency": {"oneOf": [{"type": "object", "additionalProperties": false, "required": ["kind", "name"], "properties": {"kind": {"const": "binary"}, "name": {"type": "string", "minLength": 1, "maxLength": 128, "pattern": "^[A-Za-z0-9][A-Za-z0-9._+-]*(?![\\s\\S])"}}}, {"type": "object", "additionalProperties": false, "required": ["kind", "url_token"], "properties": {"kind": {"const": "http-health"}, "url_token": {"type": "string", "minLength": 1, "maxLength": 64, "pattern": "^[A-Z][A-Z0-9_]*(?![\\s\\S])"}}}]}
  }
}
