{
  "schema": "temperance.install-surface.fragment.v1",
  "schema_uri": "https://thoughtseed.space/schemas/temperance/install-surface/fragment/v1",
  "version": {
    "major": 1,
    "minor": 0
  },
  "records": [
    {
      "id": "skills.temperance-engine",
      "owner": "temperance-engine",
      "class": "COPY",
      "source": "skills/temperance-engine",
      "destination": {
        "root_token": "HOME",
        "relative_path": ".agents/skills/temperance-engine",
        "ownership": {
          "kind": "exclusive-path"
        }
      },
      "authority": {
        "requirement_ids": [
          "PROV-02",
          "PROV-04",
          "PROV-07"
        ],
        "isa": "ISC-769"
      },
      "eligibility": {
        "platforms": [
          "darwin",
          "linux"
        ],
        "profiles": [
          "default"
        ],
        "required": true
      },
      "verification": {
        "method": "sha256",
        "expected": {
          "kind": "tree",
          "files": {
            "README.md": "sha256:3d9d814e2fa26270da018014851ee8604f9ed3a1e13f7bf697e4b12dc76eee70",
            "SKILL.md": "sha256:2c9a2f1e03e88182ab714dc3e5e6cec14a4e519fdee8faee9ffc1d8382012d1d"
          },
          "modes": {
            "README.md": "0644",
            "SKILL.md": "0644"
          }
        }
      },
      "rollback": {
        "policy": "restore-backup"
      }
    },
    {
      "id": "skills.temperance-native",
      "owner": "temperance-engine",
      "class": "COPY",
      "source": "skills/temperance-native",
      "destination": {
        "root_token": "HOME",
        "relative_path": ".agents/skills/temperance-native",
        "ownership": {
          "kind": "exclusive-path"
        }
      },
      "authority": {
        "requirement_ids": [
          "PROV-02",
          "PROV-04",
          "PROV-07"
        ],
        "isa": "ISC-769"
      },
      "eligibility": {
        "platforms": [
          "darwin",
          "linux"
        ],
        "profiles": [
          "default"
        ],
        "required": true
      },
      "verification": {
        "method": "sha256",
        "expected": {
          "kind": "tree",
          "files": {
            "SKILL.md": "sha256:3a5b39a34230be89b427c88cdd467d46d5e7ac950fd4868e46278c1bffee81c6"
          },
          "modes": {
            "SKILL.md": "0644"
          }
        }
      },
      "rollback": {
        "policy": "restore-backup"
      }
    },
    {
      "id": "skills.temperance-algorithm",
      "owner": "temperance-engine",
      "class": "COPY",
      "source": "skills/temperance-algorithm",
      "destination": {
        "root_token": "HOME",
        "relative_path": ".agents/skills/temperance-algorithm",
        "ownership": {
          "kind": "exclusive-path"
        }
      },
      "authority": {
        "requirement_ids": [
          "PROV-02",
          "PROV-04",
          "PROV-07"
        ],
        "isa": "ISC-769"
      },
      "eligibility": {
        "platforms": [
          "darwin",
          "linux"
        ],
        "profiles": [
          "default"
        ],
        "required": true
      },
      "verification": {
        "method": "sha256",
        "expected": {
          "kind": "tree",
          "files": {
            "SKILL.md": "sha256:0e0ace256e79f8e730ebd98dae69275109b2acdc6bd70551a7f9928e888da8da"
          },
          "modes": {
            "SKILL.md": "0644"
          }
        }
      },
      "rollback": {
        "policy": "restore-backup"
      }
    },
    {
      "id": "skills.temperance-parallel-dispatch",
      "owner": "temperance-engine",
      "class": "COPY",
      "source": "skills/temperance-parallel-dispatch",
      "destination": {
        "root_token": "HOME",
        "relative_path": ".agents/skills/temperance-parallel-dispatch",
        "ownership": {
          "kind": "exclusive-path"
        }
      },
      "authority": {
        "requirement_ids": [
          "PROV-02",
          "PROV-04",
          "PROV-07"
        ],
        "isa": "ISC-769"
      },
      "eligibility": {
        "platforms": [
          "darwin",
          "linux"
        ],
        "profiles": [
          "default"
        ],
        "required": true
      },
      "verification": {
        "method": "sha256",
        "expected": {
          "kind": "tree",
          "files": {
            "SKILL.md": "sha256:24205504ff0f3e663611d58ff85b2ecc774c8f4053a00e1e471ed8349a8d03d4"
          },
          "modes": {
            "SKILL.md": "0644"
          }
        }
      },
      "rollback": {
        "policy": "restore-backup"
      }
    }
  ]
}
